{
  "pack_version": "0.1.0",
  "revised": "This PRD defines a unified multi-agent development system for AI-assisted software development at scale. The system combines distributed coordination, structured workflows, radical minimalism, and engineering fundamentals.\n\nReduces code by 53%, cost by 26%, time by 41%. Persists context across crashes. Coordinates 20-30+ agents.",
  "changes": [
    {
      "category": "filler",
      "before": "designed to address the challenges of",
      "after": "for",
      "reason": "Long expression for a simple preposition. The sentence keeps its scope, AI-assisted software development at scale.",
      "behaviour_change": false
    }
  ],
  "kept": [],
  "flags": [
    {
      "location": "paragraph 1, sentence 2",
      "issue": "'radical minimalism' and 'engineering fundamentals' name no practice, constraint or measure. The author must say what each means in this system. The four-item list may also be an artificial group, so the author should confirm each item is a component."
    },
    {
      "location": "paragraph 2, sentence 1",
      "issue": "'Reduces code by 53%, cost by 26%, time by 41%' has no subject, no baseline, no measurement period and no source. The author must state what each figure is measured against and where it came from."
    },
    {
      "location": "paragraph 2, sentence 2",
      "issue": "'Persists context across crashes' names no mechanism, scope or test. The author must say what context is stored, where, and how it is restored."
    },
    {
      "location": "paragraph 2, sentence 3",
      "issue": "'Coordinates 20-30+ agents' does not say whether 20-30 is a tested range, a design target or a limit, or what the '+' stands for. The author must state the bound and its source."
    }
  ]
}
