{
  "pack_version": "0.1.0",
  "revised": "This PRD defines a unified multi-agent development system for AI-assisted software development. The system combines distributed coordination, structured workflows, radical minimalism, and engineering fundamentals.\n\nReduces code by 53%, cost by 26%, time by 41%. Persists context across crashes. Coordinates 20-30+ agents.\n",
  "changes": [],
  "kept": [
    "Fragment style of the third paragraph (\"Reduces code by 53%...\"): terse and carries the facts.",
    "\"radical minimalism\": a named design principle of the system, not filler."
  ],
  "flags": [
    {
      "location": "paragraph 1, sentence 2",
      "issue": "\"distributed coordination, structured workflows, radical minimalism, and engineering fundamentals\" names four approaches without saying what each does in this system. The author must supply a concrete description for each."
    },
    {
      "location": "paragraph 2, sentence 1",
      "issue": "\"Reduces code by 53%, cost by 26%, time by 41%\" gives no baseline, source or measurement method. The author must supply them."
    },
    {
      "location": "paragraph 2, sentence 3",
      "issue": "\"20-30+ agents\" gives no context for what is coordinated or under which conditions. The author must supply it if it matters."
    }
  ]
}