{
  "pack_version": "0.1.0",
  "revised": "This PRD defines a unified multi-agent development system for AI-assisted software development. The system combines distributed coordination, structured workflows, radical minimalism, and engineering fundamentals.\n\nReduces code by 53%, cost by 26%, time by 41%. Persists context across crashes. Coordinates 20-30+ agents.\n",
  "changes": [
    {
      "category": "filler",
      "before": "designed to address the fundamental challenges of",
      "after": "for",
      "reason": "Long generic purpose clause for a simple statement; the sentence keeps its subject and object.",
      "behaviour_change": false
    },
    {
      "category": "vague_claim",
      "before": " at scale",
      "after": "",
      "reason": "Vague scope phrase with no number or detail; the sentence keeps every fact.",
      "behaviour_change": false
    },
    {
      "category": "ai_vocabulary",
      "before": "into a cohesive platform",
      "after": "",
      "reason": "Stock phrase; the sentence keeps the same list of components.",
      "behaviour_change": false
    }
  ],
  "kept": [],
  "flags": [
    {
      "location": "paragraph 2",
      "issue": "Benchmark figures (53% code, 26% cost, 41% time) have no source, baseline or sample. The author must supply one."
    }
  ]
}
