{
  "pack_version": "0.1.0",
  "revised": "class Agent:\n    def __init__(self, name: str) -> None:\n        self.name = name\n",
  "changes": [
    {
      "category": "premature_abstraction",
      "before": "class AbstractAgentFactory(ABC): ... @abstractmethod def create_agent(self, name: str) -> Agent",
      "after": "(removed; callers construct Agent(name) directly)",
      "reason": "Abstract interface with exactly one implementation and no present need for a second. The `abc` import is removed with it.",
      "behaviour_change": false
    },
    {
      "category": "premature_abstraction",
      "before": "class ConcreteAgentFactory(AbstractAgentFactory): def create_agent(self, name: str) -> Agent: return Agent(name=name)",
      "after": "(removed; callers construct Agent(name) directly)",
      "reason": "Factory with one implementation that only forwards to the Agent constructor. Its docstring states it is the only implementation in use.",
      "behaviour_change": false
    },
    {
      "category": "redundant_comment",
      "before": "# Create the agent object and return it to the caller.",
      "after": "(deleted)",
      "reason": "Repeats the return statement. It went away with the factory class.",
      "behaviour_change": false
    }
  ],
  "kept": [],
  "flags": [
    {
      "location": "AbstractAgentFactory and ConcreteAgentFactory",
      "issue": "Removing the factory classes removes two public names. Search the codebase for imports and calls of create_agent and replace them with Agent(name=...). A person or the test suite must confirm that no caller depends on the factory, for example through dependency injection or a mock."
    }
  ]
}
