{
  "pack_version": "0.1.0",
  "revised": "A review agent takes one pull request at a time. The worker it runs on opens a worktree for the pull request, runs the checks there, and posts one comment with the findings. The review agent is one process: it reports when it is done and marks the pull request as reviewed.\n",
  "changes": [],
  "kept": [],
  "flags": []
}
