{
  "pack_version": "0.1.0",
  "revised": "class Agent:\n    def __init__(self, name: str) -> None:\n        self.name = name\n",
  "changes": [
    {
      "category": "premature_abstraction",
      "before": "from abc import ABC, abstractmethod; class AbstractAgentFactory(ABC) with abstract create_agent; class ConcreteAgentFactory(AbstractAgentFactory), its only implementation",
      "after": "",
      "reason": "Interface and factory with one implementation, which its docstring states is the only one in use. Removed along with the abc import. Agent(name=name) is what the factory returned, so callers that construct Agent directly get the same result.",
      "behaviour_change": false
    },
    {
      "category": "redundant_comment",
      "before": "# Create the agent object and return it to the caller.",
      "after": "",
      "reason": "Repeats the code on the next line. Removed with the factory method it sat in.",
      "behaviour_change": false
    }
  ],
  "kept": [],
  "flags": [
    {
      "location": "module level: AbstractAgentFactory and ConcreteAgentFactory",
      "issue": "Removing these names breaks any module that imports them. The reviewer cannot see other files. The author or the test suite must confirm that no caller imports them, or move those callers to Agent(name=...), before merging."
    }
  ]
}
