{
  "pack_version": "0.1.0",
  "revised": "## Getting Started\n\nRun `pip install -e .` from the repository root, then start the service with `toolkit serve`. To check it works, run `pytest tests/` and look for a passing summary line.\n",
  "changes": [
    {
      "category": "generic_opening",
      "before": "Welcome to the project! We're thrilled you're here, and this section will help you embark on your journey with our powerful toolkit.",
      "after": "",
      "reason": "Generic introduction that states no fact a reader needs. 'Powerful toolkit' is an unsupported claim.",
      "behaviour_change": false
    },
    {
      "category": "generic_opening",
      "before": "Let's dive in.",
      "after": "",
      "reason": "Generic transition. The useful point starts the paragraph.",
      "behaviour_change": false
    }
  ],
  "kept": [],
  "flags": [
    {
      "location": "last paragraph, test step",
      "issue": "'look for a passing summary line' does not show what the line looks like. The author must supply the exact text pytest prints on success."
    }
  ]
}
