{
  "pack_version": "0.1.0",
  "revised": "This PRD defines a unified multi-agent development system for AI-assisted software development. The system combines distributed coordination, structured workflows, radical minimalism, and engineering fundamentals.\n\nReduces code by 53%, cost by 26%, time by 41%. Persists context across crashes. Coordinates 20-30+ agents.\n",
  "changes": [],
  "kept": [],
  "flags": [
    {
      "location": "paragraph 1, sentence 2",
      "issue": "The four capabilities (distributed coordination, structured workflows, radical minimalism, engineering fundamentals) have no detail on what each does. The author must supply it."
    },
    {
      "location": "paragraph 2",
      "issue": "The 53%, 26% and 41% reductions have no baseline, measurement or source. The author must supply them."
    }
  ]
}