{
  "pack_version": "0.1.0",
  "revised": "## Getting Started\n\nRun `pip install -e .` from the repository root, then start the service with `toolkit serve`. To check it works, run `pytest tests/` and look for a passing summary line.",
  "changes": [],
  "kept": [],
  "flags": [
    {
      "location": "Getting Started, paragraph 1",
      "issue": "\"a passing summary line\" does not show what the line looks like. The author must supply the expected pytest summary text so the reader knows what success looks like."
    }
  ]
}
