{
  "pack_version": "0.1.0",
  "revised": "I think the monorepo layout is the right call for this team, and I would choose it again. It keeps every pack in one place, so a reviewer sees the whole change at once.",
  "changes": [],
  "kept": [
    "First-person opinion: \"I think the monorepo layout is the right call for this team, and I would choose it again.\"",
    "Concrete reason in the second sentence (every pack in one place, a reviewer sees the whole change at once), which states a specific benefit and matches no listed pattern."
  ],
  "flags": []
}
