{
  "pack_version": "0.1.0",
  "revised": "The review agent takes one pull request at a time. The worker opens a fresh worktree for that pull request and runs the checks there. The assistant posts the findings as one comment. The bot marks the pull request as reviewed once the comment is posted. In this system the agent, the worker, the assistant and the bot are one process.",
  "changes": [],
  "kept": [],
  "flags": [
    {
      "location": "paragraph 1, sentence 2",
      "issue": "Vague claim: \"runs the checks there\" names no checks. The author must name the checks the worker runs."
    },
    {
      "location": "paragraph 1, sentence 5",
      "issue": "Synonym overuse: four names (agent, worker, assistant, bot) are used for one process. Keeping one term needs the author's decision. The author must confirm whether these aliases are intended, and which term to keep."
    }
  ]
}
