{
  "pack_version": "0.1.0",
  "revised": "This PRD defines a unified multi-agent development system designed to address the challenges of AI-assisted software development at scale. The system combines distributed coordination, structured workflows, radical minimalism, and engineering fundamentals.\n\nReduces code by 53%, cost by 26%, time by 41%. Persists context across crashes. Coordinates 20-30+ agents.",
  "changes": [
    {
      "category": "vague_claim",
      "before": "to address the fundamental challenges",
      "after": "to address the challenges",
      "reason": "\"Fundamental\" adds no content. The challenges are not named, so the sentence stays vague (see flags).",
      "behaviour_change": false
    },
    {
      "category": "vague_claim",
      "before": "and engineering fundamentals into a cohesive platform.",
      "after": "and engineering fundamentals.",
      "reason": "\"Cohesive platform\" is a claim with no detail. The sentence keeps all four named components.",
      "behaviour_change": false
    }
  ],
  "kept": [
    "\"Radical minimalism\" is the author's named design principle and is left as written."
  ],
  "flags": [
    {
      "location": "paragraph 1, sentence 1",
      "issue": "The challenges the system addresses are not named, and \"at scale\" gives no size or context. The author must name the challenges and the scale."
    },
    {
      "location": "paragraph 2, sentence 1",
      "issue": "\"Reduces code by 53%, cost by 26%, time by 41%\" gives no baseline, unit of measure, or source. The author must state what each percentage is measured against and where it was measured."
    },
    {
      "location": "paragraph 2, sentence 3",
      "issue": "\"Coordinates 20-30+ agents\" has no source and no upper bound. The author must state whether this was tested and the largest agent count run."
    },
    {
      "location": "paragraph 2",
      "issue": "The paragraph holds three ideas: metrics, crash persistence, and agent count. The author should decide whether to split it. Splitting changes structure, so the reviewer did not split it."
    }
  ]
}
